{
  "run_id": "WATCH-RUN-20260521-213931",
  "created_at": "2026-05-21T19:39:31.418Z",
  "mode": "manual_local",
  "status": "queued",
  "source_scope": "green-source-watch-targets only",
  "allowed_source_risk_tiers": [
    "green"
  ],
  "blocked_source_risk_tiers": [
    "yellow",
    "red"
  ],
  "queue_count": 7,
  "enabled_source_count": 7,
  "blocked_source_count": 0,
  "candidate_count": 0,
  "draft_count": 0,
  "promotion_packet_count": 0,
  "public_publish_count": 0,
  "remote_write_attempted": false,
  "cron_triggered": false,
  "public_site_mutated": false,
  "safety_flags": {
    "only_green_sources_enabled": true,
    "yellow_red_blocked": true,
    "aiid_oecd_aiaaic_blocked": true,
    "no_raw_html": true,
    "no_third_party_text": true,
    "no_secrets": true,
    "no_env_committed": true
  },
  "output_paths": {
    "manual_queue": "data/ops/watch-runs/manual-queue-latest.json",
    "manual_queue_manifest": "data/ops/watch-runs/manual-queue-manifest.json",
    "manual_run_envelope": "data/ops/watch-runs/manual-run-latest.json"
  }
}
